{"checks":[{"assumptions":[],"conditions":[],"does_not_establish":["attempted_invocation","comparison_result","merge_decision","proof_correctness","source_fidelity"],"evidence":[{"kind":"packet-inspection-observation","locator":"comparator-packet-observation.json","sha256":"sha256:16db1276ba826db42ed51949ad0e63b95b22c2d70e9e01d7799afd9775409b7a","statement":"A retained packet inspection found no exact Comparator executable, toolchain lock, invocation, or execution result in scope.","witness":""}],"id":"comparator-packet-identity","implementation":{"kind":"retained_procedure","locator":"comparator-packet-procedure.json","name":"comparator-packet-inspection","root":"sha256:433b6e6384b73eec47e09d11213c5140114a492073aad9e7aad4b1abb4d46f8a","version":"1"},"inputs":[{"artifact_id":"head-source","id":"head-lean-blob","kind":"git-blob","locator":"FormalConjectures/Paper/Rupert.lean@868cc092aeb713dbf8027883c5fa575e550cfae9","root":"sha256:49bec542e7c93319ca4a1c4a2b0b3a18bf72baaf7621416a30685e311a6ef7cf"},{"artifact_id":"comparator-procedure","id":"method","kind":"retained-procedure","locator":"comparator-packet-procedure.json","root":"sha256:433b6e6384b73eec47e09d11213c5140114a492073aad9e7aad4b1abb4d46f8a"},{"artifact_id":"comparator-observation","id":"observation","kind":"packet-inspection-observation","locator":"comparator-packet-observation.json","root":"sha256:16db1276ba826db42ed51949ad0e63b95b22c2d70e9e01d7799afd9775409b7a"},{"artifact_id":"repository-authority","id":"repository-authority","kind":"normalized-repository-result","locator":"PullRequestAuditCoreSnapshot.result","root":"sha256:ed59eaf75b4440c7946ff86a50fa3c06cbc41d3146dc3c330f8e2f0573150047"},{"artifact_id":"repository-query","id":"repository-query","kind":"graphql-query","locator":"PullRequestAuditCoreSnapshot","root":"sha256:ea66d6fc53eaee9f08ab7cb5312f06e5353c647c0e4db9ad97827eafc293319e"},{"artifact_id":"repository-request","id":"repository-request","kind":"request-identity","locator":"PullRequestAuditCoreSnapshot.request","root":"sha256:c57967316a7b74472b8bee53a9cb73cdf953e5ffc87cb1b1fc36625fe2ecf72e"},{"artifact_id":"typed-result-comparator-packet-identity","id":"typed-result","kind":"typed-result","locator":"typed-result/deterministic_adapter/formal_conjectures_pr_audit","root":"sha256:ec2069c5e463afbbf4ddc2f1ecaac86ecc8eb52ae6eec0d3b58f11a8c19f9efe"}],"kind":"metadata","limitations":["This packet-inspection check alone does not establish attempted invocation; the separate Comparator tool-availability check carries the retained attempt."],"mode":"retained_replay","outcome":"unavailable","proofs":[],"property":"comparator-packet-identity","role":"producer","scope":{"declarations":["Rupert.is_every_convex_polyhedron_rupert"],"paths":["FormalConjectures/Paper/Rupert.lean"],"revision":"head"},"severity":"none"},{"assumptions":[],"conditions":[],"does_not_establish":["comparison_result","merge_decision","proof_absence","proof_failure","proof_incorrectness","source_fidelity"],"evidence":[{"kind":"tool-invocation-result","locator":"comparator-missing-tool-invocation.json","sha256":"sha256:1f967eb7e8abdf4be2e5b90e415434b493ee8229f3b5d4997ac98f7b93326600","statement":"A real inert Comparator availability invocation was attempted under the declared closed PATH; no executable resolved and no process started.","witness":""}],"id":"comparator-tool-availability","implementation":{"kind":"retained_procedure","locator":"missing-tool-invocation-procedure.py","name":"comparator-availability-preflight","root":"sha256:c5a5a8ee435dbe381ae533cad2030d1ad35b2c1de4317d63fd66548fbdc3376e","version":"1"},"inputs":[{"artifact_id":"head-source","id":"head-lean-blob","kind":"git-blob","locator":"FormalConjectures/Paper/Rupert.lean@868cc092aeb713dbf8027883c5fa575e550cfae9","root":"sha256:49bec542e7c93319ca4a1c4a2b0b3a18bf72baaf7621416a30685e311a6ef7cf"},{"artifact_id":"comparator-invocation-result","id":"invocation-result","kind":"tool-invocation-result","locator":"comparator-missing-tool-invocation.json","root":"sha256:1f967eb7e8abdf4be2e5b90e415434b493ee8229f3b5d4997ac98f7b93326600"},{"artifact_id":"comparator-invocation-procedure","id":"method","kind":"python-source","locator":"missing-tool-invocation-procedure.py","root":"sha256:c5a5a8ee435dbe381ae533cad2030d1ad35b2c1de4317d63fd66548fbdc3376e"},{"artifact_id":"repository-authority","id":"repository-authority","kind":"normalized-repository-result","locator":"PullRequestAuditCoreSnapshot.result","root":"sha256:ed59eaf75b4440c7946ff86a50fa3c06cbc41d3146dc3c330f8e2f0573150047"},{"artifact_id":"repository-query","id":"repository-query","kind":"graphql-query","locator":"PullRequestAuditCoreSnapshot","root":"sha256:ea66d6fc53eaee9f08ab7cb5312f06e5353c647c0e4db9ad97827eafc293319e"},{"artifact_id":"repository-request","id":"repository-request","kind":"request-identity","locator":"PullRequestAuditCoreSnapshot.request","root":"sha256:c57967316a7b74472b8bee53a9cb73cdf953e5ffc87cb1b1fc36625fe2ecf72e"},{"artifact_id":"typed-result-comparator-tool-availability","id":"typed-result","kind":"typed-result","locator":"typed-result/deterministic_adapter/formal_conjectures_pr_audit","root":"sha256:0fe9c98169e2caabe5f6a3f06560be2912f462b19f10d712d34b7e39bad37cdd"}],"kind":"mechanical","limitations":["Unavailable is scoped to the Comparator executable in the declared environment; no proof comparison ran."],"mode":"retained_replay","outcome":"unavailable","proofs":[],"property":"comparator-tool-availability","role":"producer","scope":{"declarations":["Rupert.is_every_convex_polyhedron_rupert"],"paths":["FormalConjectures/Paper/Rupert.lean"],"revision":"head"},"severity":"none"},{"assumptions":[],"conditions":[],"does_not_establish":["merge_decision","proof_correctness","source_fidelity"],"evidence":[{"kind":"github-check-run","locator":"https://github.com/google-deepmind/formal-conjectures/actions/runs/25608941188/job/75175625578","sha256":"sha256:a23c1a088d181e869144ba146789ea7b974c5d6120b8d831b41b098066dd1a54","statement":"The exact PR head completed the repository Build project job successfully.","witness":""}],"id":"exact-head-build","implementation":{"kind":"github_actions_workflow","locator":".github/workflows/build-and-docs.yml@868cc092aeb713dbf8027883c5fa575e550cfae9","name":"build-and-docs","root":"sha256:8841d7fe334bc84abe5d72ae923be08510e5bf661edfc4e15ed135abffaac39c","version":"1"},"inputs":[{"artifact_id":"base-source","id":"base-lean-blob","kind":"git-blob","locator":"FormalConjectures/Paper/Rupert.lean@99ae49df4b27d9d95877c562ab9e1fd9b7ff1dc7","root":"sha256:fc118aad528350a7f9f8a59fa4a96969d51f381f82cf83b3586a337e67ab81c6"},{"artifact_id":"build-job","id":"build-job","kind":"github-check-run","locator":"https://github.com/google-deepmind/formal-conjectures/actions/runs/25608941188/job/75175625578","root":"sha256:a23c1a088d181e869144ba146789ea7b974c5d6120b8d831b41b098066dd1a54"},{"artifact_id":"head-source","id":"head-lean-blob","kind":"git-blob","locator":"FormalConjectures/Paper/Rupert.lean@868cc092aeb713dbf8027883c5fa575e550cfae9","root":"sha256:49bec542e7c93319ca4a1c4a2b0b3a18bf72baaf7621416a30685e311a6ef7cf"},{"artifact_id":"repository-authority","id":"repository-authority","kind":"normalized-repository-result","locator":"PullRequestAuditCoreSnapshot.result","root":"sha256:ed59eaf75b4440c7946ff86a50fa3c06cbc41d3146dc3c330f8e2f0573150047"},{"artifact_id":"repository-query","id":"repository-query","kind":"graphql-query","locator":"PullRequestAuditCoreSnapshot","root":"sha256:ea66d6fc53eaee9f08ab7cb5312f06e5353c647c0e4db9ad97827eafc293319e"},{"artifact_id":"repository-request","id":"repository-request","kind":"request-identity","locator":"PullRequestAuditCoreSnapshot.request","root":"sha256:c57967316a7b74472b8bee53a9cb73cdf953e5ffc87cb1b1fc36625fe2ecf72e"},{"artifact_id":"typed-result-exact-head-build","id":"typed-result","kind":"typed-result","locator":"typed-result/retained_external_result/github_actions","root":"sha256:af931d6a9186e5616e75e287536a02e0b76873d5184a3725178d559523e1a541"},{"artifact_id":"method-workflow","id":"workflow","kind":"workflow","locator":".github/workflows/build-and-docs.yml@868cc092aeb713dbf8027883c5fa575e550cfae9","root":"sha256:8841d7fe334bc84abe5d72ae923be08510e5bf661edfc4e15ed135abffaac39c"},{"artifact_id":"method-workflow-identity","id":"workflow-identity","kind":"git-object-identity","locator":".github/workflows/build-and-docs.yml@868cc092aeb713dbf8027883c5fa575e550cfae9","root":"sha256:1076b2229da2ce44184a65b3b975a6bce67edbe77d9da417bcd0a3c79358394c"}],"kind":"mechanical","limitations":["A successful Lean build does not identify or compare the externally linked proof artifact."],"mode":"retained_replay","outcome":"pass","proofs":[],"property":"lean-build","role":"producer","scope":{"declarations":["Rupert.is_every_convex_polyhedron_rupert"],"paths":["FormalConjectures/Paper/Rupert.lean"],"revision":"head"},"severity":"none"},{"assumptions":[],"conditions":[],"does_not_establish":["merge_decision","proof_absence","proof_failure","proof_incorrectness","repository_has_no_matching_proof","source_fidelity"],"evidence":[{"kind":"mutable-repository-root-metadata","locator":"FormalConjectures/Paper/Rupert.lean@868cc092aeb713dbf8027883c5fa575e550cfae9","sha256":"sha256:49bec542e7c93319ca4a1c4a2b0b3a18bf72baaf7621416a30685e311a6ef7cf","statement":"The head metadata points only to a mutable repository root with multiple candidate proof routes, not to an exact commit and file.","witness":"At PR 3959 head 868cc092, the formal_proof attribute does not identify immutable proof bytes for an independent consumer."}],"id":"formal-proof-artifact-identity","implementation":{"kind":"retained_procedure","locator":"scripts/pr_audit.py#classify_proof_target","name":"formal-proof-target-classifier","root":"sha256:2c41ae2bd4fed8f9748ebf8c57630673ca2eb7ea3c690525ea292641590c3098","version":"1"},"inputs":[{"artifact_id":"base-source","id":"base-lean-blob","kind":"git-blob","locator":"FormalConjectures/Paper/Rupert.lean@99ae